{
  "attestation": {
    "external_probe_targets": [
      "socket.connect",
      "socket.create_connection",
      "subprocess.Popen"
    ],
    "measurement_authenticity": false,
    "mode": "local-unattested",
    "provider_probe_targets": [
      "provider-skill-adapter",
      "recall-provider",
      "reviewer-adapter"
    ],
    "zero_count_source": "isolated-effect-probe"
  },
  "benchmark_id": "m9-05-human-governance",
  "gate": {
    "failed_gates": [],
    "status": "passed"
  },
  "generated_at": "2026-08-18T23:20:00+08:00",
  "latency_ms": {
    "max": 3.263577,
    "min": 1.534104,
    "p50": 1.604492,
    "p95": 2.872505
  },
  "latency_samples_ms": [
    1.784669,
    1.547037,
    2.742691,
    2.847406,
    2.777217,
    1.604658,
    1.669583,
    1.625759,
    1.638621,
    1.647079,
    1.634541,
    1.631917,
    1.780299,
    1.613047,
    1.592314,
    2.654173,
    1.969031,
    2.290886,
    1.8592,
    1.6194,
    1.612963,
    1.59857,
    1.593381,
    1.601552,
    1.576336,
    1.609885,
    1.611649,
    1.587357,
    1.702792,
    1.980111,
    1.72794,
    1.61008,
    2.112685,
    2.78681,
    1.698629,
    1.746182,
    1.574391,
    1.572868,
    1.6036,
    1.581045,
    1.580625,
    1.586432,
    2.649982,
    2.34375,
    1.601339,
    1.584169,
    1.608456,
    2.313302,
    1.63973,
    1.651739,
    1.567176,
    1.596156,
    1.592034,
    1.611247,
    1.614903,
    2.147431,
    1.684682,
    1.614905,
    1.58015,
    1.69991,
    1.68481,
    1.685781,
    1.659406,
    1.651009,
    2.036852,
    1.624609,
    2.503865,
    3.187113,
    2.326051,
    1.612564,
    2.009328,
    1.587624,
    1.599739,
    1.733245,
    1.62119,
    1.65341,
    1.637568,
    1.619773,
    1.598061,
    1.604871,
    1.577848,
    1.593794,
    1.825787,
    2.923146,
    2.8733,
    2.887504,
    2.89179,
    2.872114,
    1.740213,
    1.61897,
    1.599977,
    1.59322,
    1.611856,
    1.600821,
    1.616984,
    1.568075,
    1.59392,
    1.597247,
    1.588394,
    1.607702,
    1.555476,
    1.589089,
    1.592476,
    1.578955,
    1.611082,
    1.600637,
    2.458354,
    2.538577,
    1.589638,
    1.539052,
    1.568876,
    1.561598,
    1.547371,
    1.559213,
    1.545348,
    1.54878,
    1.560009,
    1.565843,
    1.545411,
    1.559305,
    1.552134,
    1.554783,
    1.555404,
    1.561362,
    1.543641,
    1.555674,
    1.558875,
    1.546871,
    1.566466,
    1.560667,
    1.546168,
    1.556519,
    1.554634,
    1.56056,
    1.548336,
    1.572283,
    1.548318,
    1.556336,
    1.54014,
    1.834409,
    2.895559,
    2.883159,
    2.842787,
    2.338558,
    1.698951,
    1.661629,
    1.666616,
    1.66782,
    1.653192,
    1.677678,
    1.665072,
    2.256015,
    2.887827,
    2.8983,
    2.857428,
    2.884206,
    2.83178,
    2.886381,
    2.857243,
    2.821614,
    2.839886,
    2.826917,
    2.83677,
    2.842228,
    2.881061,
    2.85597,
    2.86598,
    1.919951,
    1.606647,
    1.596175,
    1.587635,
    1.595123,
    1.598387,
    1.605883,
    1.698075,
    2.386318,
    2.077138,
    1.62484,
    1.612468,
    1.613792,
    1.592411,
    1.605436,
    1.581969,
    1.577608,
    1.601647,
    1.599146,
    1.593086,
    1.606737,
    1.594983,
    1.602845,
    1.583533,
    1.604019,
    1.595496,
    1.584162,
    1.596915,
    1.597053,
    1.774996,
    1.62724,
    1.617057,
    1.629208,
    1.564666,
    1.625908,
    1.616175,
    1.619833,
    1.615734,
    1.600254,
    1.560202,
    1.607533,
    1.605838,
    1.59865,
    1.604156,
    1.789327,
    1.613868,
    1.614376,
    1.591613,
    1.597211,
    1.59875,
    1.603848,
    1.70293,
    1.649167,
    1.614273,
    1.613575,
    1.613151,
    1.582015,
    1.604032,
    1.589159,
    1.628029,
    1.616437,
    1.601936,
    1.579585,
    1.588421,
    1.607634,
    1.612803,
    1.595776,
    1.596962,
    1.597585,
    1.584402,
    1.595997,
    1.584858,
    1.606018,
    1.60683,
    1.60692,
    1.592252,
    1.588666,
    1.575879,
    1.697185,
    1.634654,
    1.608515,
    1.604599,
    1.613459,
    1.597824,
    1.579093,
    1.593559,
    1.613888,
    1.606991,
    1.600198,
    1.57307,
    2.064144,
    1.616238,
    1.612238,
    1.598912,
    1.60143,
    1.593229,
    1.59031,
    1.600304,
    1.606032,
    1.583715,
    1.608613,
    1.575724,
    1.60285,
    1.597166,
    1.608778,
    1.578317,
    1.586032,
    1.597667,
    1.594162,
    1.613764,
    1.603237,
    1.59211,
    1.596635,
    1.58879,
    1.602714,
    1.571747,
    1.614369,
    1.603772,
    1.603548,
    1.611985,
    1.6654,
    1.613369,
    1.615632,
    1.59675,
    1.594119,
    1.607329,
    1.58423,
    1.591849,
    1.591475,
    1.608952,
    1.585737,
    1.594795,
    1.610527,
    1.597592,
    1.608308,
    1.990636,
    1.637687,
    1.587212,
    1.577309,
    1.599055,
    1.605879,
    1.5925,
    1.62802,
    1.586412,
    2.159242,
    1.925209,
    1.595493,
    1.591127,
    1.600684,
    1.605663,
    1.610083,
    1.623104,
    1.577778,
    1.734475,
    1.700357,
    1.625215,
    1.614901,
    1.61053,
    2.044201,
    2.867863,
    1.747538,
    1.608316,
    1.609243,
    1.598839,
    1.605424,
    1.610021,
    1.601556,
    1.560778,
    1.591905,
    1.621027,
    1.592631,
    1.609563,
    1.681182,
    1.696276,
    1.732297,
    3.263577,
    3.198476,
    3.111626,
    3.07345,
    3.020647,
    2.237337,
    1.613745,
    1.566321,
    1.724743,
    1.614436,
    1.616908,
    1.601696,
    1.58802,
    1.582713,
    1.608341,
    1.597076,
    1.600953,
    1.605424,
    1.599184,
    1.581273,
    1.593938,
    1.586923,
    1.609144,
    1.888073,
    1.649381,
    1.596881,
    1.610554,
    1.604075,
    1.598225,
    1.581133,
    1.587712,
    1.60822,
    1.604023,
    1.590579,
    1.58996,
    1.595441,
    1.602319,
    1.582831,
    1.600689,
    1.583872,
    1.610751,
    1.609073,
    1.588855,
    1.604492,
    1.581021,
    1.594669,
    1.60877,
    1.598813,
    1.597541,
    1.611318,
    1.58184,
    1.567602,
    2.224689,
    1.911162,
    1.603131,
    1.611165,
    1.675323,
    1.624389,
    1.608499,
    1.615312,
    1.595244,
    2.271339,
    2.088294,
    1.597814,
    1.553327,
    1.548477,
    1.566301,
    1.551901,
    1.539167,
    1.552671,
    1.534104,
    1.560534,
    1.542121,
    1.552153,
    1.537309,
    1.554823,
    1.541276,
    1.549085,
    1.547855,
    1.561505,
    1.546181,
    1.565051,
    1.550866,
    1.545747,
    1.54635,
    1.542762,
    1.558145,
    1.558034,
    1.548929,
    1.550456,
    1.557388,
    1.564413,
    1.541112,
    1.732151,
    1.6403,
    1.633049,
    1.605998,
    1.608884,
    1.594646,
    1.581195,
    1.598125,
    1.600907,
    1.605352,
    1.597355,
    1.591329,
    1.600477,
    1.57884,
    1.586583,
    2.71177,
    2.865582,
    2.901211,
    2.866594,
    2.869786,
    2.987949,
    2.909893,
    2.468035,
    1.621143,
    1.583246,
    1.604521,
    1.60256,
    1.609181,
    1.602125,
    1.606707,
    1.580751,
    1.710656,
    1.682247,
    1.687444,
    1.880744,
    2.488897,
    2.932765,
    2.845929,
    2.861476,
    2.833971,
    2.866372,
    2.845564,
    2.881192,
    2.865546,
    2.891743,
    2.85884,
    2.891251,
    2.877754,
    2.891114,
    2.865458,
    2.929184,
    2.809692,
    2.870282,
    2.602057,
    1.635202,
    1.613179,
    1.579659,
    1.859288,
    1.714065,
    1.604691,
    1.612758,
    1.623836,
    1.577753,
    1.590707,
    1.591759,
    1.598972,
    1.60488,
    1.591691,
    1.590128,
    1.570958,
    1.622222,
    1.596425,
    1.92071,
    1.697428,
    1.6006,
    1.557419,
    1.562293,
    1.554917,
    1.545919,
    1.558564,
    1.560166,
    1.568901,
    1.550187,
    1.54663,
    1.567139,
    1.548742,
    1.570691,
    1.543702,
    1.550959,
    1.551182,
    1.55126,
    1.566394,
    1.564952,
    1.547094,
    1.549319,
    1.563841,
    1.559162,
    1.563915,
    1.562703,
    1.569568,
    1.568907,
    1.546797,
    1.549499,
    1.552732,
    1.555345,
    1.667354,
    1.643325,
    1.611263,
    1.561395,
    1.604844,
    1.622947,
    1.605854,
    1.607498,
    1.599822,
    1.603936,
    1.565802,
    1.598496,
    1.60312,
    1.612063,
    1.592731,
    1.616995,
    1.561566,
    1.595183,
    1.584246,
    1.603232,
    1.598704,
    1.619757,
    1.60326,
    1.596238,
    1.616363,
    1.590889,
    1.603988,
    1.699117,
    1.754944,
    1.637011,
    1.613857,
    1.594475,
    1.581182,
    1.60763,
    1.589068,
    1.598502,
    1.598176,
    1.602749,
    2.338851,
    1.816751,
    1.605742,
    1.617056,
    1.616554,
    1.606328,
    1.560155,
    1.608553,
    1.608881,
    1.602128,
    1.607074,
    1.611172,
    1.579972,
    1.61058,
    1.797652,
    2.454335,
    1.920231,
    1.619115,
    1.610553,
    1.613741,
    1.594503,
    1.601334,
    1.569906,
    1.606376,
    1.607554,
    1.6014,
    1.606799,
    1.608564,
    1.602211,
    1.577381,
    1.615676,
    1.585301,
    1.598265,
    1.601924,
    1.587006,
    1.572889,
    2.453921,
    1.647937,
    1.606073,
    1.589901,
    1.590925,
    1.596499,
    1.61779,
    1.617161,
    1.590617,
    1.601997,
    1.59135,
    1.57555,
    2.450909,
    2.868247,
    2.895376,
    2.860995,
    2.862758,
    2.854713,
    2.848608,
    2.8555,
    2.859045,
    2.879722,
    2.851076,
    2.879708,
    2.850624,
    2.878794,
    2.858299,
    2.860807,
    2.851787,
    2.742835,
    2.538751,
    2.869233,
    2.235863,
    1.627883,
    1.595368,
    1.607503,
    1.595729,
    1.585619,
    1.599737,
    1.59953,
    1.600938,
    1.596714,
    2.483952,
    2.856723,
    2.868826,
    2.875918,
    2.848177,
    2.879542,
    2.849903,
    2.880116,
    2.867389,
    1.92443,
    1.718473,
    1.620629,
    1.617738,
    1.610126,
    1.574043,
    1.596056,